[
  {
    "id": "collection:001",
    "name": "The Original Three",
    "sourceGroup": "Forest",
    "requirements": [
      {
        "familyId": "miscrit:1",
        "sourceName": "Flue",
        "quantity": 1,
        "formId": null,
        "levelConstraint": null
      },
      {
        "familyId": "miscrit:2",
        "sourceName": "Flowerpiller",
        "quantity": 1,
        "formId": null,
        "levelConstraint": null
      },
      {
        "familyId": "miscrit:3",
        "sourceName": "Prawnja",
        "quantity": 1,
        "formId": null,
        "levelConstraint": null
      }
    ],
    "rewards": [
      {
        "quantity": 10,
        "name": "Platinum"
      }
    ],
    "claimPolicy": "manual-user-tracking",
    "provenance": {
      "sourceId": "companion-collections",
      "retrievedOn": "2026-09-15",
      "method": "rendered-dom",
      "gameVerified": false
    }
  },
  {
    "id": "collection:002",
    "name": "Withered Trees",
    "sourceGroup": "Forest",
    "requirements": [
      {
        "familyId": "miscrit:21",
        "sourceName": "Treemur",
        "quantity": 1,
        "formId": null,
        "levelConstraint": null
      },
      {
        "familyId": "miscrit:507",
        "sourceName": "Dark Treemur",
        "quantity": 1,
        "formId": null,
        "levelConstraint": null
      }
    ],
    "rewards": [
      {
        "quantity": 15,
        "name": "Gems"
      }
    ],
    "claimPolicy": "manual-user-tracking",
    "provenance": {
      "sourceId": "companion-collections",
      "retrievedOn": "2026-09-15",
      "method": "rendered-dom",
      "gameVerified": false
    }
  },
  {
    "id": "collection:003",
    "name": "The Dark Three",
    "sourceGroup": "Forest",
    "requirements": [
      {
        "familyId": "miscrit:23",
        "sourceName": "Dark Flue",
        "quantity": 1,
        "formId": null,
        "levelConstraint": null
      },
      {
        "familyId": "miscrit:24",
        "sourceName": "Dark Flowerpiller",
        "quantity": 1,
        "formId": null,
        "levelConstraint": null
      },
      {
        "familyId": "miscrit:25",
        "sourceName": "Dark Prawnja",
        "quantity": 1,
        "formId": null,
        "levelConstraint": null
      }
    ],
    "rewards": [
      {
        "quantity": 30,
        "name": "Platinum"
      }
    ],
    "claimPolicy": "manual-user-tracking",
    "provenance": {
      "sourceId": "companion-collections",
      "retrievedOn": "2026-09-15",
      "method": "rendered-dom",
      "gameVerified": false
    }
  },
  {
    "id": "collection:004",
    "name": "Blight Falls",
    "sourceGroup": "Forest",
    "requirements": [
      {
        "familyId": "miscrit:430",
        "sourceName": "Blighted Cubsprout",
        "quantity": 1,
        "formId": null,
        "levelConstraint": null
      },
      {
        "familyId": "miscrit:425",
        "sourceName": "Defilio",
        "quantity": 1,
        "formId": null,
        "levelConstraint": null
      },
      {
        "familyId": "miscrit:433",
        "sourceName": "Blighted Flue",
        "quantity": 1,
        "formId": null,
        "levelConstraint": null
      },
      {
        "familyId": "miscrit:546",
        "sourceName": "Blighted Flowerpiller",
        "quantity": 1,
        "formId": null,
        "levelConstraint": null
      }
    ],
    "rewards": [
      {
        "quantity": 1,
        "name": "Gold Pack"
      }
    ],
    "claimPolicy": "manual-user-tracking",
    "provenance": {
      "sourceId": "companion-collections",
      "retrievedOn": "2026-09-15",
      "method": "rendered-dom",
      "gameVerified": false
    }
  },
  {
    "id": "collection:005",
    "name": "Among The Elder Tree",
    "sourceGroup": "Forest + Hidden Forest",
    "requirements": [
      {
        "familyId": "miscrit:19",
        "sourceName": "Steamguin",
        "quantity": 1,
        "formId": null,
        "levelConstraint": null
      },
      {
        "familyId": "miscrit:380",
        "sourceName": "Flurfy",
        "quantity": 1,
        "formId": null,
        "levelConstraint": null
      },
      {
        "familyId": "miscrit:18",
        "sourceName": "Squibee",
        "quantity": 1,
        "formId": null,
        "levelConstraint": null
      },
      {
        "familyId": "miscrit:14",
        "sourceName": "Nessy",
        "quantity": 1,
        "formId": null,
        "levelConstraint": null
      }
    ],
    "rewards": [
      {
        "quantity": 2,
        "name": "XP Token (Huge)"
      }
    ],
    "claimPolicy": "manual-user-tracking",
    "provenance": {
      "sourceId": "companion-collections",
      "retrievedOn": "2026-09-15",
      "method": "rendered-dom",
      "gameVerified": false
    }
  },
  {
    "id": "collection:006",
    "name": "Dark Descent, III",
    "sourceGroup": "Forest + Hidden Forest",
    "requirements": [
      {
        "familyId": "miscrit:19",
        "sourceName": "Steamguin",
        "quantity": 1,
        "formId": null,
        "levelConstraint": null
      },
      {
        "familyId": "miscrit:18",
        "sourceName": "Squibee",
        "quantity": 1,
        "formId": null,
        "levelConstraint": null
      },
      {
        "familyId": "miscrit:505",
        "sourceName": "Dark Steamguin",
        "quantity": 1,
        "formId": null,
        "levelConstraint": null
      },
      {
        "familyId": "miscrit:511",
        "sourceName": "Dark Squibee",
        "quantity": 1,
        "formId": null,
        "levelConstraint": null
      }
    ],
    "rewards": [
      {
        "quantity": 20,
        "name": "Platinum"
      }
    ],
    "claimPolicy": "manual-user-tracking",
    "provenance": {
      "sourceId": "companion-collections",
      "retrievedOn": "2026-09-15",
      "method": "rendered-dom",
      "gameVerified": false
    }
  },
  {
    "id": "collection:007",
    "name": "First Friends",
    "sourceGroup": "Forest + Mansion",
    "requirements": [
      {
        "familyId": "miscrit:6",
        "sourceName": "Sparkupine",
        "quantity": 1,
        "formId": null,
        "levelConstraint": null
      },
      {
        "familyId": "miscrit:5",
        "sourceName": "Cubsprout",
        "quantity": 1,
        "formId": null,
        "levelConstraint": null
      },
      {
        "familyId": "miscrit:7",
        "sourceName": "Hydroseal",
        "quantity": 1,
        "formId": null,
        "levelConstraint": null
      }
    ],
    "rewards": [
      {
        "quantity": 2,
        "name": "XP Token (Small)"
      }
    ],
    "claimPolicy": "manual-user-tracking",
    "provenance": {
      "sourceId": "companion-collections",
      "retrievedOn": "2026-09-15",
      "method": "rendered-dom",
      "gameVerified": false
    }
  },
  {
    "id": "collection:008",
    "name": "Pushing Onwards",
    "sourceGroup": "Forest + Mansion",
    "requirements": [
      {
        "familyId": "miscrit:10",
        "sourceName": "Flameling",
        "quantity": 1,
        "formId": null,
        "levelConstraint": null
      },
      {
        "familyId": "miscrit:11",
        "sourceName": "Lumera",
        "quantity": 1,
        "formId": null,
        "levelConstraint": null
      },
      {
        "familyId": "miscrit:9",
        "sourceName": "Quirk",
        "quantity": 1,
        "formId": null,
        "levelConstraint": null
      },
      {
        "familyId": "miscrit:8",
        "sourceName": "Snortus",
        "quantity": 1,
        "formId": null,
        "levelConstraint": null
      }
    ],
    "rewards": [
      {
        "quantity": 2,
        "name": "XP Token (Medium)"
      }
    ],
    "claimPolicy": "manual-user-tracking",
    "provenance": {
      "sourceId": "companion-collections",
      "retrievedOn": "2026-09-15",
      "method": "rendered-dom",
      "gameVerified": false
    }
  },
  {
    "id": "collection:009",
    "name": "Growing Stronger",
    "sourceGroup": "Forest + Mansion",
    "requirements": [
      {
        "familyId": "miscrit:101",
        "sourceName": "Whik",
        "quantity": 1,
        "formId": null,
        "levelConstraint": null
      },
      {
        "familyId": "miscrit:15",
        "sourceName": "Hotfoot",
        "quantity": 1,
        "formId": null,
        "levelConstraint": null
      },
      {
        "familyId": "miscrit:12",
        "sourceName": "Snatcher",
        "quantity": 1,
        "formId": null,
        "levelConstraint": null
      },
      {
        "familyId": "miscrit:17",
        "sourceName": "Shellbee",
        "quantity": 1,
        "formId": null,
        "levelConstraint": null
      }
    ],
    "rewards": [
      {
        "quantity": 2,
        "name": "XP Token (Large)"
      }
    ],
    "claimPolicy": "manual-user-tracking",
    "provenance": {
      "sourceId": "companion-collections",
      "retrievedOn": "2026-09-15",
      "method": "rendered-dom",
      "gameVerified": false
    }
  },
  {
    "id": "collection:010",
    "name": "Dark Descent, I",
    "sourceGroup": "Forest + Mansion",
    "requirements": [
      {
        "familyId": "miscrit:15",
        "sourceName": "Hotfoot",
        "quantity": 1,
        "formId": null,
        "levelConstraint": null
      },
      {
        "familyId": "miscrit:17",
        "sourceName": "Shellbee",
        "quantity": 1,
        "formId": null,
        "levelConstraint": null
      },
      {
        "familyId": "miscrit:95",
        "sourceName": "Dark Hotfoot",
        "quantity": 1,
        "formId": null,
        "levelConstraint": null
      },
      {
        "familyId": "miscrit:502",
        "sourceName": "Dark Shellbee",
        "quantity": 1,
        "formId": null,
        "levelConstraint": null
      }
    ],
    "rewards": [
      {
        "quantity": 15,
        "name": "Platinum"
      }
    ],
    "claimPolicy": "manual-user-tracking",
    "provenance": {